{
  "$schema":"https://json-schema.org/draft/2020-12/schema","title":"MapRouteAccumulation","type":"object",
  "required":["title","subtitle","origin","routes","unit","takeaway","source"],
  "properties":{"title":{"type":"string","minLength":1},"subtitle":{"type":"string","minLength":1},"origin":{"type":"object","required":["label","coordinate"],"properties":{"label":{"type":"string"},"coordinate":{"$ref":"#/$defs/coordinate"}},"additionalProperties":false},"routes":{"type":"array","minItems":1,"maxItems":8,"items":{"type":"object","required":["label","destination","value","color"],"properties":{"label":{"type":"string"},"destination":{"$ref":"#/$defs/coordinate"},"value":{"type":"number","minimum":0},"color":{"type":"string","pattern":"^#[0-9A-Fa-f]{6}$"}},"additionalProperties":false}},"unit":{"type":"string"},"takeaway":{"type":"string","minLength":1},"source":{"type":"string","minLength":1}},
  "$defs":{"coordinate":{"type":"array","prefixItems":[{"type":"number","minimum":-180,"maximum":180},{"type":"number","minimum":-90,"maximum":90}],"items":false}},"additionalProperties":false
}
